{
  "analysis_id": "ana_mvp001",
  "access": "free",
  "period": {
    "from": "2026-08-22",
    "to": "2026-09-07"
  },
  "summary": {
    "total_spent_mxn": 2847.23,
    "receipt_count": 3,
    "item_count": 63,
    "store_count": 2,
    "store_names": ["Soriana Hiper", "Oxxo"]
  },
  "categories": [
    {
      "id": "proteina",
      "label": "Proteína",
      "total_mxn": 882.64,
      "share": 0.31
    },
    {
      "id": "abarrotes",
      "label": "Abarrotes",
      "total_mxn": 626.39,
      "share": 0.22
    },
    {
      "id": "bebidas",
      "label": "Bebidas",
      "total_mxn": 512.5,
      "share": 0.18
    },
    {
      "id": "lacteos",
      "label": "Lácteos",
      "total_mxn": 398.61,
      "share": 0.14
    },
    {
      "id": "limpieza",
      "label": "Limpieza",
      "total_mxn": 256.05,
      "share": 0.09
    },
    {
      "id": "frutas_verduras",
      "label": "Frutas y verduras",
      "total_mxn": 171.04,
      "share": 0.06
    }
  ],
  "personality": {
    "id": "personality_norteno_constitucional",
    "emoji": "🥩",
    "title": "El Norteño Constitucional",
    "one_liner": "La carne no es una categoría. Es infraestructura.",
    "description": "Tu categoría dominante fue proteína y apareció en varios de tus tickets.",
    "evidence": [
      {
        "metric": "category_share",
        "label": "Proteína",
        "value": 0.31
      }
    ],
    "share_text": "Al parecer para mí la carne no es comida. Es infraestructura."
  },
  "basic_savings": {
    "available": true,
    "headline": "La Coca-Cola no costó lo mismo en todos lados",
    "detail": "El mismo producto normalizado apareció a distinto precio por litro en Soriana Hiper y Oxxo.",
    "modeled_difference_mxn": 13.75,
    "evidence": [
      {
        "metric": "unit_price_mxn_per_l",
        "label": "Soriana Hiper",
        "value": 16.5
      },
      {
        "metric": "unit_price_mxn_per_l",
        "label": "Oxxo",
        "value": 22.0
      }
    ]
  },
  "share_payload": {
    "template": "personality",
    "brand": "Lleno",
    "emoji": "🥩",
    "title": "El Norteño Constitucional",
    "primary_text": "La carne no es una categoría. Es infraestructura.",
    "stat": {
      "label": "de mi despensa fue proteína",
      "display_value": "31%"
    },
    "footer": "lleno.io"
  },
  "full": null,
  "upgrade": {
    "available": true,
    "price_mxn": 109.0,
    "max_receipts": 15
  }
}
